{
  "schema_version": "1.0.0",
  "tool": {
    "name": "binary-workbench",
    "version": "0.1.0"
  },
  "metadata": {
    "generated_at": "2026-10-05T05:41:28.829513+00:00",
    "host": "Windows",
    "host_machine": "AMD64",
    "python": "3.13.7"
  },
  "sample": {
    "sha256": "5557c9fc59d06f0fd493c340a346d2a21761f061e7b15ff7e35574aa52e50119",
    "size": 2048
  },
  "static": {
    "sha256": "5557c9fc59d06f0fd493c340a346d2a21761f061e7b15ff7e35574aa52e50119",
    "size": 2048,
    "format": "PE",
    "status": "complete",
    "warnings": [],
    "sections": [
      {
        "name": ".text",
        "offset": 1024,
        "file_size": 512,
        "va": "0x140001000",
        "memory_size": 146,
        "permissions": "rx",
        "valid": true,
        "entropy": 2.28969621055176,
        "rva": "0x1000",
        "id": "section:0"
      },
      {
        "name": ".rdata",
        "offset": 1536,
        "file_size": 512,
        "va": "0x140002000",
        "memory_size": 410,
        "permissions": "r",
        "valid": true,
        "entropy": 3.9444005591899827,
        "rva": "0x2000",
        "id": "section:1"
      }
    ],
    "segments": [],
    "regions": [
      {
        "name": ".text",
        "offset": 1024,
        "file_size": 512,
        "va": "0x140001000",
        "memory_size": 146,
        "permissions": "rx",
        "valid": true,
        "entropy": 2.28969621055176,
        "rva": "0x1000",
        "id": "section:0"
      },
      {
        "name": ".rdata",
        "offset": 1536,
        "file_size": 512,
        "va": "0x140002000",
        "memory_size": 410,
        "permissions": "r",
        "valid": true,
        "entropy": 3.9444005591899827,
        "rva": "0x2000",
        "id": "section:1"
      },
      {
        "name": "headers",
        "offset": 0,
        "file_size": 1024,
        "va": "0x140000000",
        "memory_size": 1024,
        "permissions": "r",
        "valid": true,
        "entropy": 1.1775452914320912
      }
    ],
    "imports": [],
    "exports": [
      {
        "name": "branch_fixture",
        "rva": "0x1000",
        "va": "0x140001000",
        "forwarder": null
      },
      {
        "name": "entry_fixture",
        "rva": "0x1060",
        "va": "0x140001060",
        "forwarder": null
      },
      {
        "name": "fixture_html",
        "rva": "0x2050",
        "va": "0x140002050",
        "forwarder": null
      },
      {
        "name": "fixture_marker",
        "rva": "0x2000",
        "va": "0x140002000",
        "forwarder": null
      },
      {
        "name": "fixture_url",
        "rva": "0x2020",
        "va": "0x140002020",
        "forwarder": null
      },
      {
        "name": "fixture_wide",
        "rva": "0x2080",
        "va": "0x140002080",
        "forwarder": null
      },
      {
        "name": "string_fixture",
        "rva": "0x1030",
        "va": "0x140001030",
        "forwarder": null
      }
    ],
    "symbols": [],
    "dependencies": [],
    "resources": [],
    "certificates": [],
    "overlay": null,
    "file_entropy": 3.0032575138075677,
    "headers": {
      "Machine": 34404,
      "NumberOfSections": 2,
      "TimeDateStamp": 1791177240,
      "Characteristics": 34
    },
    "strings": [
      {
        "id": "string:ascii:4d",
        "text": "!This program cannot be run in DOS mode.$",
        "encoding": "ascii",
        "file_offset": 77,
        "length": 41,
        "truncated": false
      },
      {
        "id": "string:ascii:180",
        "text": ".text",
        "encoding": "ascii",
        "file_offset": 384,
        "length": 5,
        "truncated": false
      },
      {
        "id": "string:utf-16le:1a4",
        "text": " \u6000\u722e\u6164\u6174",
        "encoding": "utf-16le",
        "file_offset": 420,
        "length": 10,
        "truncated": false
      },
      {
        "id": "string:ascii:1a7",
        "text": "`.rdata",
        "encoding": "ascii",
        "file_offset": 423,
        "length": 7,
        "truncated": false
      },
      {
        "id": "string:utf-16le:449",
        "text": "\ufa83\u4800\u450f\u48c1\uc483\u5d08\u66c3\u0f2e\u841f",
        "encoding": "utf-16le",
        "file_offset": 1097,
        "length": 18,
        "truncated": false
      },
      {
        "id": "string:ascii:600",
        "text": "BINARY_WORKBENCH_BENIGN_FIXTURE",
        "encoding": "ascii",
        "file_offset": 1536,
        "length": 31,
        "truncated": false
      },
      {
        "id": "string:ascii:620",
        "text": "https://example.invalid/learning",
        "encoding": "ascii",
        "file_offset": 1568,
        "length": 32,
        "truncated": false
      },
      {
        "id": "string:utf-16le:64f",
        "text": "\u3c00\u6373\u6972\u7470\u613e\u656c\u7472\u2728\u6966\u7478\u7275\u2765\u3c29\u732f\u7263\u7069\u3e74\u5b1b\u3133m",
        "encoding": "utf-16le",
        "file_offset": 1615,
        "length": 40,
        "truncated": false
      },
      {
        "id": "string:ascii:650",
        "text": "<script>alert('fixture')</script>",
        "encoding": "ascii",
        "file_offset": 1616,
        "length": 33,
        "truncated": false
      },
      {
        "id": "string:utf-16le:650",
        "text": "\u733c\u7263\u7069\u3e74\u6c61\u7265\u2874\u6627\u7869\u7574\u6572\u2927\u2f3c\u6373\u6972\u7470\u1b3e\u335b\u6d31",
        "encoding": "utf-16le",
        "file_offset": 1616,
        "length": 38,
        "truncated": false
      },
      {
        "id": "string:ascii:672",
        "text": "[31m",
        "encoding": "ascii",
        "file_offset": 1650,
        "length": 4,
        "truncated": false
      },
      {
        "id": "string:utf-16le:67f",
        "text": "\u5700\u4900\u4400\u4500\u5f00\u4600\u4900\u5800\u5400\u5500\u5200\u4500",
        "encoding": "utf-16le",
        "file_offset": 1663,
        "length": 24,
        "truncated": false
      },
      {
        "id": "string:utf-16le:680",
        "text": "WIDE_FIXTURE",
        "encoding": "utf-16le",
        "file_offset": 1664,
        "length": 24,
        "truncated": false
      },
      {
        "id": "string:ascii:6e8",
        "text": "pe-x64.exe",
        "encoding": "ascii",
        "file_offset": 1768,
        "length": 10,
        "truncated": false
      },
      {
        "id": "string:utf-16le:6e8",
        "text": "\u6570\u782d\u3436\u652e\u6578",
        "encoding": "utf-16le",
        "file_offset": 1768,
        "length": 10,
        "truncated": false
      },
      {
        "id": "string:utf-16le:70e",
        "text": "\u3900!\u4800!\u5600!\u6300!\u7200!\u7e00!\u8b00!",
        "encoding": "utf-16le",
        "file_offset": 1806,
        "length": 28,
        "truncated": false
      },
      {
        "id": "string:ascii:739",
        "text": "branch_fixture",
        "encoding": "ascii",
        "file_offset": 1849,
        "length": 14,
        "truncated": false
      },
      {
        "id": "string:utf-16le:739",
        "text": "\u7262\u6e61\u6863\u665f\u7869\u7574\u6572\u6500\u746e\u7972\u665f\u7869\u7574\u6572\u6600\u7869\u7574\u6572\u685f\u6d74l\u6966\u7478\u7275\u5f65\u616d\u6b72\u7265\u6600\u7869\u7574\u6572\u755f\u6c72\u6600\u7869\u7574\u6572\u775f\u6469e\u7473\u6972\u676e\u665f\u7869\u7574\u6572",
        "encoding": "utf-16le",
        "file_offset": 1849,
        "length": 96,
        "truncated": false
      },
      {
        "id": "string:ascii:748",
        "text": "entry_fixture",
        "encoding": "ascii",
        "file_offset": 1864,
        "length": 13,
        "truncated": false
      },
      {
        "id": "string:ascii:756",
        "text": "fixture_html",
        "encoding": "ascii",
        "file_offset": 1878,
        "length": 12,
        "truncated": false
      },
      {
        "id": "string:ascii:763",
        "text": "fixture_marker",
        "encoding": "ascii",
        "file_offset": 1891,
        "length": 14,
        "truncated": false
      },
      {
        "id": "string:ascii:772",
        "text": "fixture_url",
        "encoding": "ascii",
        "file_offset": 1906,
        "length": 11,
        "truncated": false
      },
      {
        "id": "string:ascii:77e",
        "text": "fixture_wide",
        "encoding": "ascii",
        "file_offset": 1918,
        "length": 12,
        "truncated": false
      },
      {
        "id": "string:ascii:78b",
        "text": "string_fixture",
        "encoding": "ascii",
        "file_offset": 1931,
        "length": 14,
        "truncated": false
      }
    ],
    "strings_truncated": false,
    "indicators": [
      {
        "id": "indicator:string:ascii:620:0",
        "kind": "url",
        "value": "https://example.invalid/learning",
        "source_id": "string:ascii:620",
        "file_offset": 1568,
        "length": 32
      },
      {
        "id": "indicator:string:ascii:6e8:0",
        "kind": "domain",
        "value": "pe-x64.exe",
        "source_id": "string:ascii:6e8",
        "file_offset": 1768,
        "length": 10
      }
    ],
    "indicators_truncated": false,
    "parser": {
      "name": "pefile",
      "version": "2024.8.26"
    },
    "architecture": "x64",
    "bitness": 64,
    "endianness": "little",
    "image_base": "0x140000000",
    "entry_rva": "0x1060",
    "entry_va": "0x140001060",
    "managed": false,
    "symbol_table": {
      "file_offset": 0,
      "count": 0,
      "status": "absent"
    }
  },
  "reverse_engineering": {
    "backend": "ghidra",
    "version": "12.1.4",
    "language": "x86:LE:64:default",
    "analyzers": {
      "ASCII Strings": true,
      "ASCII Strings.Create Strings Containing Existing Strings": false,
      "ASCII Strings.Create Strings Containing References": false,
      "ASCII Strings.Force Model Reload": false,
      "ASCII Strings.Require Null Termination for String": false,
      "ASCII Strings.Search Only in Accessible Memory Blocks": false,